mau_cau,giai_thich,vi_du,vi_du_romaji,nghia
① trợ từ で (công cụ / phương tiện),"[công cụ/cách thức]＋で = 'bằng ~': はしで たべます, はさみで きります. Cũng dùng với ngôn ngữ: にほんごで かきます (viết bằng tiếng Nhật).",はしで ごはんを たべます。,Hashi de gohan o tabemasu.,Tôi ăn cơm bằng đũa.
②「～」は～語で 何ですか,"Hỏi cách nói một từ trong ngôn ngữ khác: 「ありがとう」は えいごで なんですか — '""Arigatou"" tiếng Anh là gì?'. ～語 = tiếng nước ~ (えいご, にほんご).",「ありがとう」は えいごで なんですか。,“Arigatou” wa eigo de nan desu ka.,“Arigatou” tiếng Anh nói thế nào?
③ [người]に [vật]を あげます,"Cho/tặng AI cái gì: dùng に chỉ NGƯỜI NHẬN. Nhóm động từ cho đi: あげます, かします (cho mượn), おしえます (dạy), おくります (gửi), でんわを かけます.",ともだちに はなを あげます。,Tomodachi ni hana o agemasu.,Tôi tặng hoa cho bạn.
④ [người]に [vật]を もらいます,"Nhận cái gì TỪ AI: dùng に (hoặc から) chỉ NGƯỜI CHO. Nhóm động từ nhận về: もらいます, かります (mượn), ならいます (học từ ai). Hỏi: だれに.",やまださんに ほんを もらいました。,Yamada-san ni hon o moraimashita.,Tôi nhận sách từ anh Yamada.
⑤ もう ～ました,もう＋[động từ]ました = 'đã … rồi'. Trả lời: はい、もう ～ました (rồi) hoặc いいえ、まだです (chưa). KHÔNG nói いいえ、まだ ～ませんでした.,もう ひるごはんを たべましたか。,Mou hirugohan o tabemashita ka.,Bạn ăn trưa chưa?
